{
  "kind": "outline",
  "generated_at": "2026-07-06T00:00:00Z",
  "schema_version": "2.0",
  "title": "玄天剑醒来",
  "premise": "外门少女林小雨意外唤醒废剑玄天剑，被迫在宗门复测和身世谜团之间寻找活路。",
  "logline": "一个被忽视的外门少女听见废剑叫出自己的乳名，从此被卷入宗门旧案和隐藏血脉的危机。",
  "synopsis": "林小雨在天剑宗外门祠堂听见玄天剑残念传声，意识到废剑并非凡物。灵根复测随即开始，她必须隐藏异动、查清玄天剑为何认识自己，并在宗门压力下找到真正的修行道路。",
  "themes": [
    "隐藏身份",
    "废物流觉醒",
    "宗门旧案"
  ],
  "volumes": [
    {
      "volume": 1,
      "title": "废剑初醒",
      "scope": "1-30",
      "summary": "林小雨发现玄天剑苏醒，并在灵根复测中暴露出第一层异常。",
      "goal": "建立金手指、宗门压力和主角身世谜团。"
    }
  ]
}
